{
  "innsigle_keys": "1",
  "issuer_id": "azgaard-test",
  "issuer_name": "Azgaard Test",
  "keys": [
    {
      "key_id": "ed25519:cd89509bfdc9b5cf0df4e462517b59eb",
      "alg": "ed25519",
      "public_key": "ojCCFbZSoz6xNMD503p6UiWE8kGeb9sprSDeerrgkTE",
      "created_at": "2026-07-22T00:00:00Z",
      "revoked_at": null
    }
  ]
}
