{
  "innsigle_keys": "1",
  "issuer_id": "azgaard-dogfood",
  "issuer_name": "Azgaard Dogfood",
  "keys": [
    {
      "key_id": "ed25519:56a6f2f799318d5153b3ba9b5e955d3b",
      "alg": "ed25519",
      "public_key": "5yQDUeiCOKhHmtHJlZsKyM8DV3QkmeEQSF52dtmxtBs",
      "created_at": "2026-07-23T13:40:09Z",
      "revoked_at": null
    }
  ]
}
